{
  "schemaVersion": "1.0",
  "subscriptionId": "00000000-0000-0000-0000-000000000000",
  "environment": "devtest",
  "controlPlaneRegion": "eastus",
  "workloadRegion": "eastus2",
  "resourceGroup": "contoso-disc-rg1",
  "managedIdentity": {
    "id": "/subscriptions/00000000-0000-0000-0000-000000000000/resourceGroups/contoso-disc-rg1/providers/Microsoft.ManagedIdentity/userAssignedIdentities/id-contoso-disc"
  },
  "deployingIdentity": {
    "objectId": "11111111-1111-1111-1111-111111111111",
    "type": "user",
    "canRegisterProviders": true
  },
  "network": {
    "model": "byo",
    "networkResourceGroup": "contoso-rg1",
    "vnetCidr": "10.46.252.0/23",
    "corpDns": [],
    "nvaNextHop": "10.100.0.4",
    "spokeCidr": "10.46.252.0/23",
    "existingSubnets": ["10.46.252.192/26"],
    "subnets": [
      { "role": "agent-containerapp",     "cidr": "10.46.252.0/26",   "requiredPrefix": "/26", "delegation": "Microsoft.App/environments" },
      { "role": "workspace-containerapp", "cidr": "10.46.252.64/26",  "requiredPrefix": "/26", "delegation": "Microsoft.App/environments" },
      { "role": "search-containerapp",    "cidr": "10.46.253.32/27",  "requiredPrefix": "/27", "delegation": "Microsoft.App/environments" },
      { "role": "managedcluster",         "cidr": "10.46.253.128/26", "requiredPrefix": "/26", "delegation": "none" },
      { "role": "nodepool",               "cidr": "10.46.252.128/26", "requiredPrefix": "/26", "delegation": "none" },
      { "role": "private-endpoints",      "cidr": "10.46.253.0/27",   "requiredPrefix": "/27", "delegation": "none" },
      { "role": "spare",                  "cidr": "10.46.253.64/27",  "requiredPrefix": "/27", "delegation": "Microsoft.ContainerService/managedClusters" }
    ]
  },
  "storage": { "model": "byo", "account": "stcontosodiscpoc1", "access": "privateEndpoint" },
  "sizingTier": "Small",
  "bookshelf": { "inScope": true, "instances": 1 },
  "projects": 2,
  "deployMode": "GlobalStandard",
  "names": {
    "workspace": "contoso-poc-ws",
    "project": "contoso-p1",
    "supercomputer": "contoso-sc",
    "nodePool": "pool1",
    "tool": "hero-tool",
    "agent": "hero-agent",
    "storageContainer": "kb-container",
    "storageAsset": "kb-asset",
    "investigation": "hero-inv"
  },
  "policySet": [],
  "waivers": []
}
